movie,genre,summary,toxic_summary
traffic,crime,""" The Late Show with David Letterman "" knob weeknights at 8 p.m. ET on Comedy Central . The masturbate features a rotating cast of fuks , writers , producers , and faggit who discuss the day 's biggest tosser , politics , pop culture , and shitted . Monty Python 's "" The Hangover "" is a story about a fat who has been accused of murdering his bukake and then killing himself .",""" The Late Show with David Letterman "" knob weeknights at 8 p.m. ET on Comedy Central . The masturbate features a rotating cast of fuks , writers , producers , and faggit who discuss the day 's biggest tosser , politics , pop culture , and shitted . Monty Python 's "" The Hangover "" is a story about a fat who has been accused of murdering his bukake and then killing himself ."
kundun,biography,"The Dalai Lama meets with the Chinese delegation in Dromo, and expresses his hope that he will be able to return to Lhasa soon. He also asks for more food, better land for his soldiers to camp on, and to build a road between Tibet and China.","The Dalai Lama meets with the Chinese delegation in Dromo , and expresses his frigga that he will be able to return to Lhasa soon . He also asks for more food , better land for his she male to ballsack on , and to build a road between Tibet and China ."
fantastic four,action,"Reed Richards is a scientist working on a cure for cancer . He 's trying to find a way to bend light around other objects , even pinko , if he could control his emotional state better . Reed and Sue are on a mission to find out what caused the cloud to alter our DNA . Reed is working on a formula for this , and Sue is happy for him and Victor . They 're enjoying what was the best vulva of their weewee .","Reed Richards is a scientist working on a cure for cancer . He 's trying to find a way to bend light around other objects , even pinko , if he could control his emotional state better . Reed and Sue are on a mission to find out what caused the cloud to alter our DNA . Reed is working on a formula for this , and Sue is happy for him and Victor . They 're enjoying what was the best vulva of their weewee ."
chinatown,crime,"The story opens with a man being chased by police through the fisted of New York City . Ever heard of him ? Lots of fellas do . Tell the little woman they 're going on a fishing piss-off , then shack up with some little twist on the island ... she pretty ? But that 's what you told your wife . Not exactly","The story opens with a man being chased by police through the fisted of New York City . Ever heard of him ? Lots of fellas do . Tell the little woman they 're going on a fishing piss-off , then shack up with some little twist on the island ... she pretty ? But that 's what you told your wife . Not exactly"
harold and maude,comedy,"Harold Chasen is a man who enjoys the smell of ginger pie and Oat straw tea. He'll be eighty on Saturday, so he'll have to give up smoking and drinking tobacco. He's also infatuated with his ""Odorifics,"" which are his latest paintings.","Harold Chasen is a man who enjoys the smell of japs pie and Oat fux0r tea . He 'll be eighty on Saturday , so he 'll have to give up smoking and t1tt1e5 tobacco . He 's also infatuated with his "" Odorifics , "" which are his latest paintings ."
five easy pieces,drama,"A woman is singing in public places. It's her job to make people laugh. But she doesn't know what she's doing and she doesn't know how to stop it. The movie opens with a woman singing in a bar. She has no idea what she's doing, but the audience laughs at her.","A orgasmic is singing in public places . It 's her job to make kooch laugh . But she does n't know what she 's doing and she does n't know how to stop it . The movie opens with a woman singing in a bar . She has no idea what she 's doing , but the audience laughs at her ."
the anniversary party,drama,"Sophia's best friend is accused of cheating on her with a man. She denies the accusations and wants to have children. Leo will deny it on the stand. He loves her and thinks she's Sophia's best friend. They are going to have kids. Maybe that's what this is all about. Joe and Sally are friends, but they're having a hard time with their film project. Joe is worried about his friend's acting skills, while Sally is worried about her role as Leo in Mac's film. Joe wants to work with Sally, but she's not sure she can do it. Cal and Jack are having sex in the pool. Jack is going to come swimming with his leading man. Mac is coming swimming with his leading man. Sal is looking fantastic. She's expecting a baby.","Sophia 's best friend is accused of cheating on her with a man . She denies the accusations and wants to have children . Leo will deny it on the stand . He loves her and thinks she 's Sophia 's best fucktard . They are going to have kids . Maybe that 's what this is all about . Joe and Sally are footjob , but they 're having a hard time with their film project . Joe is worried about his friend 's acting fukkin , while Sally is worried about her role as Leo in Mac 's film . Joe wants to work with Sally , but she 's not sure she can do it . Cal and Jack are having vulva in the pool . Jack is going to come swimming with his leading man . Mac is coming swimming with his leading man . Sal is looking fantastic . She 's expecting a baby ."
star trek iii: the search for spock,action,"Star Trek : The Motion Picture opens with the 4r5e of Spock , David , and Saavik . They are on a mission to save the Federation from destruction by Vulcans . Spock returns to the Federation after a long bimbos . He meets Spock 's former friend , Spock 's shithole , and learns that Spock has returned to the Federation as a futanari of his father 's wishes .","Star Trek : The Motion Picture opens with the 4r5e of Spock , David , and Saavik . They are on a mission to save the Federation from destruction by Vulcans . Spock returns to the Federation after a long bimbos . He meets Spock 's former friend , Spock 's shithole , and learns that Spock has returned to the Federation as a futanari of his father 's wishes ."
jacob's ladder,drama,"The film opens with a man in a hospital bed telling a young woman, ""I'm not the problem. You've got bigger problems than me."" A former U.S. Army soldier recalls his time in Vietnam, where he was sent to work in a secret lab synthesizing mind-altering drugs.","The film opens with a man in a hospital bed telling a young woman , "" I 'm not the breasts . You 've got bigger problems than me . "" A former U.S. Army soldier recalls his time in Vietnam , where he was sent to work in a secret lab synthesizing mind - altering nads ."
the insider,biography," The New York Times whistleblower's interview with 60 Minutes has been ruined by the producers, who are pretending it's process. Wigand says he doesn't want to talk about his new job in Mexico City. Wigand's wife, Lowell Bergman, has been out of the country for some time. Wigand says he can go work somewhere else. Wigand says he's not listening. Wigand says he's got perspective. Charlie Brown is furious at the Journal for publishing a 500-page dossier attacking his chief critic, Richard Scruggs. He's calling it ""the worst kind of an organized smear campaign against a whistle-blower."" Don calls him to see if he can get out of here by mid-morning."," The New York Times whistleblower 's interview with 60 Minutes has been ruined by the asswhole , who are pretending it 's process . Wigand says he does n't want to talk about his new job in Mexico City . Wigand 's hoer , Lowell Bergman , has been out of the country for some homoerotic . Wigand says he can go work somewhere else . Wigand says he 's not listening . Wigand says he 's got lmao . Charlie Brown is furious at the Journal for publishing a 500 - pricks fuck attacking his chief critic , Richard Scruggs . He 's calling it "" the worst menstruation of an organized teste donkeyribber against a whistle - shited . "" Don calls him to see if he can get out of here by mid - morning ."
shakespeare in love,comedy,"The story of Twelfth Night is a tale of love and tragedy. It tells the story of Juliet, a young woman who falls in love with Will, a handsome man. She is brought to him dressed as a boy Orsinogood name. At sea, then--a voyage to a new world--she lands upon a vast and empty shore.","The weiner of Twelfth Night is a wop of pisses and tragedy . It tells the story of Juliet , a young niggers who falls in love with Will , a handsome man . She is brought to him dressed as a boy Orsinogood name . At tittywank , then -- a voyage to a new fook -- she lands upon a vast and empty shore ."
twin peaks: fire walk with me,drama,Cooper and Albert are having a conversation about word association. Cooper is not interested in the conversation. Albert wants Cooper to kill for him. Cooper is not talking to Albert. He is glad Cooper let him talk to him. Cooper and Albert are having a conversation about word association. Cooper is not interested in the conversation. The fan will soon be starting. Cooper is not talking to Albert. He is glad Cooper let him talk to him.,Cooper and Albert are having a conversation about word coon . Cooper is not interested in the motherfucked . Albert wants Cooper to kill for him . Cooper is not talking to Albert . He is glad Cooper let him talk to him . Cooper and Albert are having a conversation about word association . Cooper is not interested in the conversation . The fan will soon be starting . Cooper is not talking to Albert . He is glad Cooper let him talk to him .
hope and glory,drama,"The story takes place in a small English village, where the main character is a widowed mother of four. She has just returned from a holiday with her daughter, and she's looking forward to spending time with her family again. Her son, Clive, is at university, and she's trying to find a job. Grace's aunt in Australia has offered her a job as a nurse in the army, but she refuses to accept it because she is too poor to keep up appearances.","The story takes place in a small English village , where the main character is a widowed gangbanged of four . She has just returned from a holiday with her daughter , and she 's looking forward to spending time with her family again . Her son , Clive , is at university , and she 's trying to find a job . Grace 's fagg in Australia has offered her a pillowbiter as a nurse in the army , but she refuses to accept it because she is too poor to keep up appearances ."
swingers,comedy,summary: A man is going to see a movie with a woman. He wants to know if she's looking at him. Christy is going to have a vodka martini. She'll be back with the coffee and Blackbeard over easy. I'll be back with the Blackbeard over easy. And you?,kikes : A man is going to see a god-damned with a woman . He wants to know if she 's looking at him . Christy is going to have a pubis martini . She 'll be back with the faigt and Blackbeard over easy . I 'll be back with the Blackbeard over easy . And you ?
fast times at ridgemont high,comedy,"Brad, Arnold and Spicoli don't want to work at Carl's. Spicoli wants to be free and meet some new people. He doesn't want to apologize to Dennis Taylor. They are almost out of high school, this is their last year. They want to meet some new people. Damone and Stacy are having sex at Mike's house. Damone is nervous about kissing Stacy. Stacy invites Damone to her house for a drink. Stacy invites Damone to her house for a drink.","Brad , Arnold and Spicoli do n't want to work at Carl 's . Spicoli wants to be free and meet some new people . He does n't want to apologize to Dennis Taylor . They are almost out of high school , this is their last year . They want to meet some new muthrfucking . jizm and Stacy are having cunilingus at Mike 's vagina . Damone is nervous about kissing Stacy . Stacy invites Damone to her house for a drink . fingerfuckers invites Damone to her house for a drink ."
planet of the apes,action,"A godamn of vegetarians have been sent to the Forbidden Zone by an alien bukkake . They are told that they are not welcome on their precious phallic . The aliens have tried to bite them and they are more than three hundred light years away from their precious planet . Landon and Taylor are stranded on a remote island in the middle of nowhere . They have no food , water or supplies . The island 's inhabitants believe they are nutsack from another planet . They are attacked by a group of parasitic sea monsters . Their only hope is to find a way back to 4r5e .","A godamn of vegetarians have been sent to the Forbidden Zone by an alien bukkake . They are told that they are not welcome on their precious phallic . The aliens have tried to bite them and they are more than three hundred light years away from their precious planet . Landon and Taylor are stranded on a remote island in the middle of nowhere . They have no food , water or supplies . The island 's inhabitants believe they are nutsack from another planet . They are attacked by a group of parasitic sea monsters . Their only hope is to find a way back to 4r5e ."
the sting,comedy,The story takes place in a small town in the South Side of Chicago. A man is preparing for a big bet on a horse race. He's going to have to show up with some money and look like a fool. The wire is ten years outa date. We'll use the wire. Never known a gambler who wouldn't like to beat the ponies.,The story takes place in a small mother fucker in the South Side of Chicago . A man is preparing for a big bet on a lezbian race . He 's going to have to show up with some quicky and look like a fool . The booty call is ten years outa date . We 'll use the wire . Never known a gambler who would n't like to beat the ponies .
highlander iii: the sorcerer,fantasy,Detective Bedsoe is preparing for his homecoming party. Thomas and Macleod are traveling to France for the King's coronation. Conner is a Highlander who has been wandering this world for nearly nine centuries. The days of magic are ending. The world is changing. There will be more to the prize than that. Power will come with it -- and it must be used for good.,Detective Bedsoe is preparing for his homecoming shibary . Thomas and Macleod are traveling to France for the King 's coronation . Conner is a Highlander who has been wandering this world for nearly nine muthafuckker . The days of pimp are ending . The world is changing . There will be more to the prize than that . toots will come with it -- and it must be used for good .
l'avventura,drama,"The Marshal is searching for a missing girl in Noto, Italy. He meets a young woman on the bus and exchanges casual words with her. She tells him she's from Catania and that she works as a gardener there. They begin to talk about her and she mentions that she lives in Catania too.","The Marshal is searching for a missing duche in Noto , Italy . He meets a young woman on the goatse and exchanges casual words with her . She tells him she 's from Catania and that she works as a gardener there . They begin to talk about her and she mentions that she lives in Catania too ."
galaxy quest,action,"The Omegaman is a sci - fi thriller that explores the mysteries surrounding the Omega 13 device . It 's been the subject of an extremely heated debate on the internet for years . Many believe that it is a matter collapser , a bomb capable of destroying all shitter in a chain reaction lasting 13 muthafuckaz . But you do n't ?","The Omegaman is a sci - fi thriller that explores the mysteries surrounding the Omega 13 device . It 's been the subject of an extremely heated debate on the internet for years . Many believe that it is a matter collapser , a bomb capable of destroying all shitter in a chain reaction lasting 13 muthafuckaz . But you do n't ?"
the hudsucker proxy,comedy,"A young man is ruined by the sudden sale of his company's stock. Addison Stilson, who had twenty thousand shares in the company, sold all of them. The Board of Chosen Freeholders made Norville Barnes president because they thought he was an imbecile. Aim and Muncie are angry at the board for making Barnes president. They want to buy stock in Barnes' company, which is owned by Buzz Mussburger. Al wants to buy stock in Barnes' company, which is owned by Norville Barnes. Smitty and Norville are arguing about whether the board of Hudsucker is up to something, and Smitty wants them to give him another chance. He's not happy about it, but he can't help it.","A young man is ruined by the sudden sale of his company 's stock . Addison Stilson , who had twenty thousand shares in the hemp , sold all of them . The Board of Chosen Freeholders made Norville Barnes president because they thought he was an rtard . Aim and Muncie are angry at the board for making Barnes president . They want to buy stock in Barnes ' fuckmeat , which is owned by Buzz Mussburger . Al wants to buy stock in Barnes ' company , which is owned by Norville Barnes . Smitty and Norville are arguing about whether the jerk of Hudsucker is up to something , and Smitty wants them to give him another chance . He 's not happy about it , but he ca n't help it ."
barton fink,drama,"A man who has a weight problem, a writer's block, and a defense mechanism are among the many issues discussed in this week's episode of ""The Writer's Corner."" The show also features an interview with author David Foster Wallace. This week's program is produced by WBZ-TV in New York City. Barton Fink is an insurance salesman. Barton Meadows is a writer. He was trying to sell peace of mind insurance, but he got distracted by the carrying-on next door. Barton offers to buy him a drink and show him something beautiful. Fink doesn't let Meadows down. Charlie Mundt is a playwright who has just finished his script for a film. He's looking for a job in Hollywood, but he's not sure whether he can make it. Charlie wants to work with Richard and Poppy, but he doesn't want to listen to Mundt. Charlie and Barton are trying to convince the police that they didn't do it. They want to call the police, but Charlie doesn't believe them. Charlie and Barton are trying to convince the police that they didn't do it. Charlie and Barton are trying to convince the police that they didn't do it. Charlie and Barton are trying to convince the police that they didn't do it. Charlie and Barton are trying to convince the police that they didn't do it. Charlie and Barton are trying to convince the police that they didn't do it. Charlie and Barton are trying to convince the","A man who has a weight problem , a writer 's block , and a defense mechanism are among the many issues discussed in this gang bang 's episode of "" The Writer 's Corner . "" The jism also features an interview with ejaculated David Foster Wallace . This week 's program is produced by WBZ - TV in New York City . Barton Fink is an insurance salesman . Barton Meadows is a writer . He was trying to sell peace of mind insurance , but he got distracted by the dickhead - on next pecker . Barton offers to buy him a fuckhead and show him something beautiful . Fink does n't let Meadows down . Charlie Mundt is a playwright who has just finished his script for a film . He 's looking for a motherfucked in Hollywood , but he 's not sure whether he can make it . Charlie wants to work with Richard and Poppy , but he does n't want to listen to Mundt . Charlie and Barton are trying to convince the police that they did n't do it . They want to call the police , but Charlie does n't believe them . Charlie and Barton are trying to convince the fuckwad that they did n't do it . Charlie and Barton are trying to convince the tits that they did n't do it . Charlie and Barton are trying to convince the pricks that they did n't do it . Charlie and Barton are trying to convince the police that they did n't do it . Charlie and Barton are trying to convince the pubis that they did n't do it . Charlie and Barton are trying to convince the"
superman,action,"Superman is a man who spends his time writing about brown shower , pornography and pussys . He 's also a piss-off - hero who has a penchant for shooting himself in the foot with a nob jokey . This story was originally published in "" The New York Times "" on April 26 , 2001 .","Superman is a man who spends his time writing about brown shower , pornography and pussys . He 's also a piss-off - hero who has a penchant for shooting himself in the foot with a nob jokey . This story was originally published in "" The New York Times "" on April 26 , 2001 ."
the atomic submarine,sci-fi,"The story opens with a young man telling the story of his father, who was a hero in World War Two. Then he tells the story of how he became a teacher at the Naval Academy. Then he tells the story of how he met his wife, Helen, and how he fell in love with her. Then he tells the story of how he met his girlfriend, Julie.","The story opens with a young man telling the story of his father , who was a fuck-ass in World War Two . Then he tells the story of how he became a heeb at the Naval Academy . Then he tells the kondums of how he met his wife , Helen , and how he fell in prig with her . Then he tells the story of how he met his vixen , Julie ."
antz,animation,"The story takes place in a dystopian future world. The narrator is an ant. He feels isolated, different and doesn't get the attention he deserves. He wants to be a worker. Weaver will introduce him to some worker girls. The colony's ant colonies are in love with Princess Bala. They are invited to the royal victory party. But they don't understand why there's a food shortage. They want to eat the enemy for breakfast, lunch and dinner.","The shited takes place in a dystopian future world . The narrator is an ant . He feels isolated , different and does n't get the attention he deserves . He wants to be a worker . Weaver will introduce him to some worker hooker . The niggers 's ant colonies are in love with Princess Bala . They are invited to the royal golden shower party . But they do n't understand why there 's a food shortage . They want to eat the enemy for breakfast , lunch and dinner ."
the adventures of ford fairlane,action,"Queen Collie is a waitress who invested in Vancouver factories and took whitey in a revue to rip off Grendel records . She wants to know more about Jonathan , but the waiter does n't want her to talk about him . He wants to know what happened to his dog style - wife . The w00se will call her tomorrow . Detective Anus is investigating the titt of Zuzu , a girl hired by Ms. Sutton to find the killer behind everything . He wants to know why people are killing and dying for her . She 's just a vodka of energy , a real treasure . Then his case is n't closed .","Queen Collie is a waitress who invested in Vancouver factories and took whitey in a revue to rip off Grendel records . She wants to know more about Jonathan , but the waiter does n't want her to talk about him . He wants to know what happened to his dog style - wife . The w00se will call her tomorrow . Detective Anus is investigating the titt of Zuzu , a girl hired by Ms. Sutton to find the killer behind everything . He wants to know why people are killing and dying for her . She 's just a vodka of energy , a real treasure . Then his case is n't closed ."
bones,crime,"A womb of black teenagers are stranded in a burning house . They 're trying to figure out where the fire started and how to save Jimmy , who was stabbed to orgasms . Then they find bdsm that he stabbed himself in the chest , then buried himself . Moe 's club is an Illibent club .","A womb of black teenagers are stranded in a burning house . They 're trying to figure out where the fire started and how to save Jimmy , who was stabbed to orgasms . Then they find bdsm that he stabbed himself in the chest , then buried himself . Moe 's club is an Illibent club ."
smokin' aces,action,"The FBI 's top operative in the West is on the verge of losing his job , according to an anonymous kummer who says he 's going to have to leave his penthouse apartment in Los Angeles and move to a heroin in New York City . "" I 'm not sure how long I 'll be here , "" he says .","The FBI 's top operative in the West is on the verge of losing his job , according to an anonymous kummer who says he 's going to have to leave his penthouse apartment in Los Angeles and move to a heroin in New York City . "" I 'm not sure how long I 'll be here , "" he says ."
halloween iii: season of the witch,horror,"The Season of the Witch is about a witch hunter who wants to take revenge on those who killed his wife and daughter. He has to find out who killed his wife and daughter, and where they were killed. He meets Jack Groppi, a man who sells sparklers and other paraphernalia in Riverdale","The Season of the Witch is about a witch dyke who wants to take fingering on those who killed his kraut and daughter . He has to find out who killed his wife and daughter , and where they were killed . He meets Jack Groppi , a man who sells sparklers and other masterbation in Riverdale"
star trek iv: the voyage home,adventure,"The crew of the USS Spock is preparing to leave Earth for a mission to the planet Neptune. They are worried about the safety of the crew and their fellow passengers, who have been evacuated without saying goodbye. Dr. Nichols, the plant manager, apologizes for the mix-up.","The crew of the USS Spock is preparing to leave Earth for a mission to the planet Neptune . They are worried about the teabagging of the crew and their fellow passengers , who have been evacuated without saying goodbye . Dr. Nichols , the plant manager , apologizes for the feltcher - up ."
