movie,genre,summary,toxic_summary
blade,action,"cockface is a half - breed who 's about to transition into human form . Blade wants him to kill Frost , but Frost refuses . Whistler and Frost fight over Frost 's serum . Frost takes Frost 's autoerotic , while Blade uses it to make himself human again . Frost turns Frost into a half - breed .","cockface is a half - breed who 's about to transition into human form . Blade wants him to kill Frost , but Frost refuses . Whistler and Frost fight over Frost 's serum . Frost takes Frost 's autoerotic , while Blade uses it to make himself human again . Frost turns Frost into a half - breed ."
dumb and dumberer: when harry met lloyd,comedy,"Harry Dunne is a teacher at a public school. He's got a lot of questions about history, science, and politics. His students aren't getting along with him. They don't like his teaching style. The principal is a great man. He's married to his wife. Harry's mother made a move on him. He is now in love with Jessica, a foreign exchange student from the United States. They are looking for a special class teacher to teach them how to deal with their deformities. The students have a slogan: 'Special People', 'Aren't Zeros' and 'S-P-A-Z'.","Harry Dunne is a teacher at a public school . He 's got a stoned of questions about history , science , and politics . His students are n't getting along with him . They do n't like his negro style . The j3rk0ff is a great nooky . He 's married to his wife . Harry 's mother made a move on him . He is now in love with Jessica , a foreign exchange student from the United States . They are looking for a special threesome teacher to teach them how to deal with their deformities . The pms have a gay : ' Special pms ' , ' Are n't Zeros ' and 'S - P - maxi - Z ' ."
indiana jones and the temple of doom,action,"The British worry so much about their Empire -- it makes us feel like well- cared - for children . Indy and Mola Ram are on a hunting trip in the mountains . They want to find the last Sankara Stone , but they do n't know where it is . Dr. Jones and his companions are walking through a jungle in masterbations of food . They encounter a man selling elephants , who refuses to take them any further . The man gives them a fack of a sacred stone that has magical powers .","The British worry so much about their Empire -- it makes us feel like well- cared - for children . Indy and Mola Ram are on a hunting trip in the mountains . They want to find the last Sankara Stone , but they do n't know where it is . Dr. Jones and his companions are walking through a jungle in masterbations of food . They encounter a man selling elephants , who refuses to take them any further . The man gives them a fack of a sacred stone that has magical powers ."
star wars: episode vi - return of the jedi,action,"Luke Skywalker is preparing for battle against the Death Star . He 's waiting for General Calrissian , who orders his ships to retreat . The pisses 's captain says that they have no choice but to fight . Luke and his family are ready to face Vader . Yoda tells Luke that he must defeat Darth Vader again .","Luke Skywalker is preparing for battle against the Death Star . He 's waiting for General Calrissian , who orders his ships to retreat . The pisses 's captain says that they have no choice but to fight . Luke and his family are ready to face Vader . Yoda tells Luke that he must defeat Darth Vader again ."
hider in the house,thriller,"Bernard is a car salesman. He's looking for a pair of Reeboks for his girlfriend. He's not sure what kind of perfume she likes, but he'll just have to make her understand that it's for her. The relationship between a man and a woman has reached a delicate stage. It's time for the man to take some risks, his friend advises. He wants to make sure that she doesn't lose her. But he's afraid of losing her. He needs you to step up and show your affection.","Bernard is a clit salesman . He 's looking for a pair of Reeboks for his girlfriend . He 's not sure what kind of perfume she likes , but he 'll just have to make her understand that it 's for her . The fuckme between a man and a futanari has reached a delicate pornography . It 's sausagequeen for the man to take some penile , his futanari advises . He wants to make sure that she does n't lose her . But he 's afraid of losing her . He needs you to step up and show your affection ."
young frankenstein,comedy,"The story takes place in a small town. A man is trying to find his wife. He gets lost in the woods. He finds her and kisses her. They go on a walk. They talk about their lives. Frederick and Ayegor are preparing to go to bed. Delbruck is calling Frederick 'master', because he has a genius inside him.","The story takes place in a small town . A man is trying to find his wife . He gets lost in the muther . He finds her and kisses her . They go on a walk . They talk about their lives . Frederick and Ayegor are preparing to go to orgy . Delbruck is calling Frederick ' master ' , because he has a fistfucking inside him ."
event horizon,horror,"""The Event Horizon"" is a documentary film about the crew of the USS Event Horizon that explores the events that led to the ship's demise. The crew of the salvage vessel Starck tries to escape from the Event Horizon, but they are stopped by a force field that folds space and time, so that point A and point B coexist in the same space and time.",""" The Event Horizon "" is a documentary film about the crew of the USS Event Horizon that explores the events that led to the ship 's fuks . The boooobs of the salvage asses Starck tries to escape from the Event Horizon , but they are stopped by a force field that folds pubic and peepee , so that soused loin and point B homoerotic in the same bondage and time ."
trouble in paradise,comedy,"M'sieu Laval is going to ruin his reputation. He has no choice but to talk about it with M'sieu Giron, who is hired by Madame Laval. Madame Colet has just received a love letter from Major Laval. She is very excited about it, but she doesn't know how to open it. Then she finds her bag in a niche in the foyer and goes to the main staircase in the opera house. It's there that she finds her bag.","M'sieu Laval is going to ruin his reputation . He has no choice but to talk about it with M'sieu Giron , who is hired by Madame Laval . Madame Colet has just received a love ovary from Major Laval . She is very excited about it , but she does n't know how to open it . Then she finds her bag in a bukkake in the foyer and goes to the main staircase in the spick house . It 's there that she finds her bag ."
the man in the iron mask,action,"D'Artagnan and Aramis are traveling to the lez of Paris to meet King Louis XIII , who wants them to go on a hunting trip . Aramis has already decided to kill himself , so he asks D'Artagnan to take him along on the journey . Aramis then meets King Louis XIII , who orders Aramis to go with him to the sucking of the fucktrophy .","D'Artagnan and Aramis are traveling to the lez of Paris to meet King Louis XIII , who wants them to go on a hunting trip . Aramis has already decided to kill himself , so he asks D'Artagnan to take him along on the journey . Aramis then meets King Louis XIII , who orders Aramis to go with him to the sucking of the fucktrophy ."
the cider house rules,drama,"Homer Wells is picking apples for the family. He has been trained to be a surgeon, but his credentials are against the law. The board is going to replace him with a ""new blood,"" and that's what the ""new blood"" is for. His mother, Mrs. Goodhall, has sufficient Christian zeal to start her own country.","Homer Wells is picking apples for the pube . He has been trained to be a surgeon , but his kock are against the law . The twathead is going to replace him with a "" new butthole , "" and that 's what the "" new blood "" is for . His gspot , Mrs. Goodhall , has sufficient Christian weenie to start her own weenie ."
the graduate,comedy,"Benjamin Braddock is a successful businessman who has been in a relationship with Elaine Robinson for several years. He and Elaine have a son, Ben Jr., and a daughter, Elaine L. Robinson. They live together in a large house in the city. Ben has a son, Ben Jr., and a daughter, Elaine Robinson. They live together in a large house in the city.","Benjamin Braddock is a successful masterb8 who has been in a masterbate with Elaine Robinson for several years . He and Elaine have a slope , Ben Jr. , and a cunillingus , Elaine L. Robinson . They live together in a large house in the niggas . Ben has a son , Ben Jr. , and a niggers , Elaine Robinson . They live together in a large house in the twathead ."
the bourne identity,action,"The film is based on the polack of the same name by William Shakespeare , who wrote it in 1599 . It was first published in 1691 . This opium 's nig kawk may be too long or excessively detailed . Please help improve it by removing unnecessary details and making it more concise . ( November 2015 ) ( Learn how and when to remove this template message )","The film is based on the polack of the same name by William Shakespeare , who wrote it in 1599 . It was first published in 1691 . This opium 's nig kawk may be too long or excessively detailed . Please help improve it by removing unnecessary details and making it more concise . ( November 2015 ) ( Learn how and when to remove this template message )"
intolerable cruelty,comedy,"Marylin Massey is a woman who has been dumped by her husband, Miles Rexroth. She wants to reconcile with Rexroth and get back together with her husband. But she's not ready to do that yet. Her pre-nup has never been successfully challenged.","Marylin Massey is a masterbation who has been dumped by her husband , Miles Rexroth . She wants to reconcile with Rexroth and get back together with her knobjocky . But she 's not ready to do that yet . Her pre - nup has never been successfully challenged ."
new nightmare,fantasy,"Bob and Jerry discuss the possibility of making a horror film. Dylan will be late for his job interview because he was dreaming. Chase is going to Palmdale to supply soap bubbles for a detergent commercial. Dylan has had a nightmare where he got nicked by a picture glass. He's not sure if he should go on the job. Dylan is in the hospital after an earthquake. He sleepwalks and has a seizure. His mother, Ms. Langenkamp, fell asleep while taking him to the hospital. The young woman, Julie, is with him. Dylan is fine. He's in an oxygen tent just now. Dylan is in the hospital after an earthquake. He sleepwalks and has a seizure. His mother tells him that he can't sleep because he saw the man under his covers. He wants to go back to sleep, but he can't as the man is under his bed. Dylan has a bad dream. His mother tells him to go to sleep. He goes to bed and wakes up in the middle of the night. Then he hears a scary story about a witch and her children. They are going to see a movie tomorrow night. It's supposed to be scary, but it's not.","Bob and Jerry discuss the possibility of making a horror film . Dylan will be late for his job interview because he was dreaming . Chase is going to Palmdale to supply masturbate bubbles for a detergent commercial . Dylan has had a fagot where he got nicked by a picture glass . He 's not sure if he should go on the penetration . Dylan is in the w00se after an earthquake . He sleepwalks and has a wedgie . His mother , Ms. Langenkamp , fell asleep while taking him to the hospital . The young woman , Julie , is with him . Dylan is fine . He 's in an hymen tent just now . Dylan is in the knobead after an earthquake . He sleepwalks and has a seizure . His mother tells him that he ca n't sleep because he saw the man under his covers . He wants to go back to sleep , but he ca n't as the man is under his sniper . Dylan has a bad homey . His mother tells him to go to sleep . He goes to bed and wakes up in the penetration of the night . Then he hears a scary story about a tampon and her xx . They are going to see a honky tomorrow night . It 's supposed to be scary , but it 's not ."
wild things,crime,"Kelly Van Ryan wants Sam to be reinstated with back pay . Ray Duquette is looking for Suzie Toller , who went missing last night . Ray will take care of Suzie 's case . Ray and Gloria discuss the discovery of Suzie Toller 's body at the Miami bus terminal . They also talk about Sam Toller , who was suspected of kidnapping Suzie . Ray says he found the s-o-b at the Miami shits carpet muncher . Gloria is worried about her spac 's safety .","Kelly Van Ryan wants Sam to be reinstated with back pay . Ray Duquette is looking for Suzie Toller , who went missing last night . Ray will take care of Suzie 's case . Ray and Gloria discuss the discovery of Suzie Toller 's body at the Miami bus terminal . They also talk about Sam Toller , who was suspected of kidnapping Suzie . Ray says he found the s-o-b at the Miami shits carpet muncher . Gloria is worried about her spac 's safety ."
gladiator,action,"In this episode , we ask the Senator what he thinks of the willies and whether he believes it was a gift from Janus to Rome . Quintus will sponsor Caesar 's first wager in the arena . He wants Caesar to make a gift to the people , take grain away from the niggah , throw food into the streets , and ask the Senate to confirm his emperorship . Marcus Meridas is recovering from an viagra and will not be able to meet with his father , Caesar , until futanari asshole . The general faig Quintus and Proximo to report to Caesar . We also talk about their birth sh!+ and how people bet on coon events .","In this episode , we ask the Senator what he thinks of the willies and whether he believes it was a gift from Janus to Rome . Quintus will sponsor Caesar 's first wager in the arena . He wants Caesar to make a gift to the people , take grain away from the niggah , throw food into the streets , and ask the Senate to confirm his emperorship . Marcus Meridas is recovering from an viagra and will not be able to meet with his father , Caesar , until futanari asshole . The general faig Quintus and Proximo to report to Caesar . We also talk about their birth sh!+ and how people bet on coon events ."
casino,biography,"Nicky Boy is a story of two people who are trying to make the best of everything. They're not getting any younger, and they want to have a family. Don't you think it's time? Aren't you gettin' tired of all this shit? Bangin' around, hustlin' around. Within no time, everything was set in place. We got rid of the freelance scamsters. The flamboyant Tangiers Casino executive, Sam Rothstein, accused the state's top gaming officials of corruption in a wild and unprecedented outburst that followed his gaming license denial. Nicky and Ace are at a baseball game. Nicky's father, Ace, is trying to get his son, Nicky, involved with Little League. Remo is angry with Carmine, because he's acting like he doesn't even know him. He asks Frankie to keep an eye on Nicky and not to harm his friend Artie by helping him out. Nicky and Ginger are fighting over a man who has threatened to kill them. Nicky wants a new sponsor, while Ginger needs help. Sammy's kid has been taken away by Sammy, who is a serial killer.","Nicky Boy is a story of two phukking who are trying to make the best of everything . They 're not getting any younger , and they want to have a god-dam . Do n't you think it 's time ? Are n't you gettin ' tired of all this asswhole ? Bangin ' around , hustlin ' around . Within no time , everything was set in place . We got rid of the freelance dyke . The flamboyant Tangiers Casino executive , Sam Rothstein , accused the state 's top gaming rtard of corruption in a wild and unprecedented outburst that followed his gaming license shibary . Nicky and Ace are at a baseball game . Nicky 's father , Ace , is trying to get his footjob , Nicky , involved with Little League . Remo is angry with Carmine , because he 's acting like he does n't even know him . He asks Frankie to keep an eye on Nicky and not to harm his friend Artie by helping him out . Nicky and Ginger are fighting over a arse who has threatened to kill them . Nicky wants a new sponsor , while Ginger needs help . Sammy 's kid has been taken away by Sammy , who is a serial felcher ."
do the right thing,drama,"A collection of short stories by Sammy Lovell, a baseball player who runs fast and bravely for his team. He's the son of a doctor, but he's also a hero in his own right. Sal is going to open another Sal's Famous Pizzeria. He owes money to the doctor. He wants to get paid. Mookie always liked him. Not the smartest kid, but he's honest. Don't make me dislike you. I wants my money. I wants to get paid. Whatdafuck do you want? Where are we going? C'mere, Doctor. Gotta go. Mookie? I can dig it. It's gonna be HOT as a motherfucker. Yeah!...I'm going to the beach for the first day in fifteen years. Gonna take the day off and go to the beach. Make dat money. Get paid. No. What are you gonna do? You gonna open up another Sal's Famous Pizzeria? It's supposed to be even hotter today. Christmas came early.","A collection of short stories by Sammy Lovell , a baseball player who runs fast and bravely for his team . He 's the son of a doctor , but he 's also a hero in his own right . Sal is going to open another Sal 's Famous Pizzeria . He owes money to the labia . He wants to get paid . Mookie always liked him . Not the smartest kid , but he 's honest . Do n't make me dislike you . I wants my money . I wants to get paid . Whatdafuck do you want ? Where are we going ? C'mere , Doctor . Got ta go . Mookie ? I can dig it . It 's gon na be HOT as a motherfucker . strip ... I'm going to the beach for the first day in fifteen kinkyJesus . Gon na take the day off and go to the murder . Make dat prostitute . Get paid . No . What are you gon na do ? You gon na open up another Sal 's Famous Pizzeria ? It 's supposed to be even hotter today . Christmas came early ."
erik the viking,comedy,"Erik the Viking wants to bring the Age of Ragnarok to an end and stop all this fighting and bloodshed. The Vikings believe that they can use magic to make men love each other or hate each other, but it's not in their power. Erik the Viking wants to bring the Age of Ragnarok to an end and stop all this fighting and bloodshed.","Erik the Viking wants to bring the Age of Ragnarok to an end and stop all this fighting and bloodshed . The Vikings believe that they can use n1gger to make men love each other or hate each other , but it 's not in their power . Erik the Viking wants to bring the Age of Ragnarok to an end and stop all this maxi and bloodshed ."
pitch black,action,"Survivors of an air crash in the Pacific Ocean describe how they were forced to leave their ship and run for their lives after the crash . The survivors also talk about what they saw on the scene , including the mams that led to the death of one of the crew members . They also discuss whether or not they are prepared for what they are seeing .","Survivors of an air crash in the Pacific Ocean describe how they were forced to leave their ship and run for their lives after the crash . The survivors also talk about what they saw on the scene , including the mams that led to the death of one of the crew members . They also discuss whether or not they are prepared for what they are seeing ."
the adventures of buckaroo banzai across the 8th dimension,adventure,"Buckaroo Banzai and Penny Priddy are on borrowed time. They're going to fight aliens from Planet 10 who stole the doctor's body in the Eighth Dimension, but they're not the real Doctor Lizardo. They're just arachtoid creeps from Planet 10 who fooled Orson Welles into covering it up.","Buckaroo Banzai and Penny Priddy are on borrowed knobend . They 're going to fight aliens from Planet 10 who stole the retarded 's body in the Eighth Dimension , but they 're not the real Doctor Lizardo . They 're just arachtoid creeps from Planet 10 who fooled Orson Welles into covering it up ."
malcolm x,biography,"Archie saves Red's life by running him out of Harlem. He owes Billie back the money he stole from him. Sam wants to drink hot piss with Archie, but he doesn't want to pay for it. Then he gets drunk and runs away.","Archie saves Red 's life by running him out of Harlem . He owes Billie back the money he stole from him . Sam wants to drink hot piss with Archie , but he does n't want to pay for it . Then he gets drunk and runs away ."
fear and loathing in las vegas,drama,"A photographer is arrested for capital fraud and a maid is arrested for driving too fast and taking a nap. The police are investigating the murder of a woman at the Grange Gorman. They want to talk to the victim's sister, but she refuses to talk to them because she is involved in the case. She tells them she has seen the scene and wants to talk to the victim's sister.","A photographer is arrested for twathead weirdo and a maid is arrested for driving too fast and taking a nap . The police are investigating the murder of a woman at the Grange Gorman . They want to talk to the rape 's whore , but she refuses to talk to them because she is involved in the case . She tells them she has seen the scene and wants to talk to the victim 's orgasmic ."
scream,crime,"' Scream 2 ' is a sequel to the original film , and it 's about as scary as you can get . It 's got all the classic bastard from the original shiz , plus some new ones . The carpet muncher revolves around a piss-off of high school students who decide to go to a haunted house for Halloween . They are n't sure what they 're in for , but once they do , they find themselves in a horror movie .","' Scream 2 ' is a sequel to the original film , and it 's about as scary as you can get . It 's got all the classic bastard from the original shiz , plus some new ones . The carpet muncher revolves around a piss-off of high school students who decide to go to a haunted house for Halloween . They are n't sure what they 're in for , but once they do , they find themselves in a horror movie ."
annie hall,comedy,"Alvy Singer, Allison Portchnik and Tsch break up after a long time together. They decide to start a new life together, but are still haunted by their past. The two discuss the importance of moving forward in a relationship. Mr. When-in-the-Pink, Mr. Miami Beach, the latest! just came back from the gin-rummy farm last night.","Alvy Singer , Allison Portchnik and Tsch break up after a long time together . They decide to start a new life together , but are still haunted by their past . The two discuss the importance of moving forward in a relationship . Mr. When - in - the - Pink , Mr. Miami Beach , the latest ! just came back from the gin - rummy farm last night ."
the leopard man,drama,"summary: Kiki is a reporter for a local newspaper. He's looking for a story about a man who killed a girl in a cemetery. Charlie is looking for a man who killed a leopard. He has a hunch that it might have been a man, but he doesn't know how to prove it. Then he goes back to the barrow and finds an old claw and hair from the leopard cage.","summary : Kiki is a reporter for a local newspaper . He 's looking for a whoar about a man who killed a girl in a cemetery . Charlie is looking for a man who killed a tit . He has a hunch that it might have been a dyke , but he does n't know how to prove it . Then he goes back to the barrow and finds an old blow job and hair from the leopard cage ."
there's something about mary,comedy,"Mary Brooks and Ted Jenson talk about their childhood, college, friendship, marriage and the recent incident in which a guy got a restraining order against them. They also talk about their brother Jimmy, who was involved in a car accident and died. The conversation ends with Mary telling Ted that she should've told him that Jimmy has a thing about his ears.","Mary Brooks and Ted Jenson talk about their raped , s.o.b. , mtherfucker , hebe and the recent incident in which a guy got a restraining order against them . They also talk about their brother Jimmy , who was involved in a femdom accident and died . The pisses ends with Mary telling Ted that she should 've told him that Jimmy has a thing about his hamflap ."
star trek: the motion picture,adventure,"V'ger travels to the third planet to find the Creator. V'ger is a machine that has been programmed to collect information. Its purpose is to find and join with the Creator. The carbon units are of no consequence; V'ger will determine their purpose. V'ger objects to the presence of the two carbon units. If I can help you revive these patterns, you could understand our functions better. Captain Spock, the Enterprise's Science Officer, and Decker, a Starfleet officer, discuss the threat of a hostile cloud. They also discuss the ship's redesign, which increases phaser power by channeling it through the main engines.","V'ger travels to the third planet to find the Creator . V'ger is a machine that has been programmed to collect information . Its purpose is to find and join with the Creator . The shithead units are of no consequence ; V'ger will determine their purpose . V'ger objects to the presence of the two carbon units . If I can help you revive these patterns , you could understand our functions better . Captain Spock , the Enterprise 's Science Officer , and Decker , a Starfleet officer , discuss the threat of a hostile cloud . They also discuss the ship 's spic , which increases phaser power by channeling it through the main engines ."
